{
  "schemaVersion": "hadara.releaseOperatorPublication.v1",
  "generatedAt": "2026-08-22T15:35:44.594Z",
  "package": {
    "name": "hadara",
    "version": "0.5.0-rc.6",
    "registry": "https://registry.npmjs.org",
    "distTag": "next",
    "npmMutationPerformed": true,
    "observedVersion": "0.5.0-rc.6",
    "distTagsBefore": {
      "latest": "0.4.6",
      "next": "0.5.0-rc.5"
    },
    "distTagsAfter": {
      "latest": "0.4.6",
      "next": "0.5.0-rc.6"
    }
  },
  "github": {
    "repository": "ictseoyoungmin/HADARA",
    "gitRemote": "https://github.com/ictseoyoungmin/HADARA.git",
    "mutationPerformed": true,
    "draftRequested": true,
    "prerelease": true,
    "assets": [
      {
        "name": "hadara-0.5.0-rc.6.tgz",
        "sha256": "sha256:f078d6edc4529943dd0842b787a6dc98fb04e4bdbefbd7e138dbcfe6c4202e1f",
        "uploaded": true
      },
      {
        "name": "hadara-0.5.0-rc.6.tgz.sha256",
        "sha256": "sha256:73bec0e80788bad6f2ebc44b9fb3d9edf4ffeaf8ef725aad8f2a7c8d67dca715",
        "uploaded": true
      },
      {
        "name": "hadara-0.5.0-rc.6.tgz.manifest.json",
        "sha256": "sha256:f1e742c427ca274fb1832f6e6100bdf54fd7213989d68b2ff639e9294f58c44a",
        "uploaded": true
      }
    ]
  },
  "lineage": {
    "taskId": "T-0797",
    "artifactSourceCommit": "e8143c0fe86dcb29aa8f99cb70612b4bd606c800",
    "releaseInputHash": "sha256:a2ad5b5a2e058ecb958eaf0fcf5846f586b032320760868f294f7dd84754681b",
    "operatorCommit": "bfbb45f3640cba1d88478d3a7ac39d0384f8a1c2",
    "approvalActor": "local-operator",
    "approvalReason": "Manual approval-gated npm publish for current package version"
  },
  "mutationBoundary": {
    "dockerMutationPerformed": false,
    "stableLatestMutationPerformed": false,
    "substituteArtifactUsed": false
  },
  "commands": {
    "npmPublish": [
      "npm",
      "publish",
      "hadara-0.5.0-rc.6.tgz",
      "--tag",
      "next"
    ],
    "githubRelease": [
      "gh",
      "release",
      "create",
      "v0.5.0-rc.6",
      "--draft",
      "--prerelease"
    ]
  }
}
